{"envelope":1,"type":"channel-pointer","payload":"eyJzY2hlbWFWZXJzaW9uIjoxLCJwcm9kdWN0SWQiOiJiZXRhLnByb2R1Y3QiLCJjaGFubmVsIjoibGl2ZSIsImNoYW5uZWxTZXF1ZW5jZSI6MSwic3VwZXJzZWRlc0NoYW5uZWxTZXF1ZW5jZSI6MCwicmVsZWFzZUlkIjoiYmV0YS0xIiwicmVsZWFzZVNlcXVlbmNlIjoxLCJyZWxlYXNlRGlnZXN0Ijoic2hhMjU2OmI0MjY4NGViOTFlNDllYTE1ZjMzOGUzM2I3ZGZmNWYzYTM1YjY5MWVhMjBlOWVkMTI4Njk0ODM5ZWY3OWM2YzYiLCJ1cGRhdGVkQXQiOiIyMDI2LTAxLTAxVDAwOjAwOjAwWiJ9","signatures":[{"keyId":"fixture-root","algorithm":"ed25519","signature":"wnIcLhdkzflHHDymbQ0T9ggghPVkwg2l7hvH8ApiimJin-pK_FgCdHi_Vi98Dlv_jXrLd3heEbaHYPamFhslBA"}]}