{"envelope":1,"type":"release-lock","payload":"eyJzY2hlbWFWZXJzaW9uIjoxLCJwcm9kdWN0SWQiOiJhbHBoYS5wcm9kdWN0IiwicmVsZWFzZUlkIjoiYWxwaGEtMiIsInNlcXVlbmNlIjoyLCJzdGF0ZSI6InB1Ymxpc2hlZCIsImNyZWF0ZWRBdCI6IjIwMjYtMDEtMDFUMDA6MDA6MDBaIiwiYXhlcyI6W10sInJlcXVpcmVtZW50cyI6W3sicGFja2FnZSI6ImFscGhhLmNvcmUiLCJ3aGVuIjp7ImNvbnN0cmFpbnRzIjp7fSwiaXNBbHdheXMiOnRydWV9LCJvdmVycmlkZXMiOltdLCJvcHRpb25hbCI6ZmFsc2V9LHsicGFja2FnZSI6ImFscGhhLnVpLm1vZGVybiIsIndoZW4iOnsiY29uc3RyYWludHMiOnt9LCJpc0Fsd2F5cyI6dHJ1ZX0sIm92ZXJyaWRlcyI6W10sIm9wdGlvbmFsIjpmYWxzZX1dLCJwYWNrYWdlcyI6W3siaWQiOiJhbHBoYS5jb3JlIiwidmVyc2lvbiI6IjEuMC4wIiwic2VxdWVuY2UiOjEsIm1hbmlmZXN0UGF0aCI6InBhY2thZ2VzL2FscGhhLmNvcmUvMS4wLjAvcGFja2FnZS5qc29uIiwibWFuaWZlc3REaWdlc3QiOiJzaGEyNTY6ZmMyNjU0NThhOTJjNjFhM2Y1ZTk4Yjg3YWNhMjJlOTdkZDM1MWJjY2M3ZDQ0Y2YzNDg2YTVhYmI4OTlkN2ExMCIsImZpbGVDb3VudCI6MSwiaW5zdGFsbFNpemUiOjExLCJkb3dubG9hZFNpemUiOjExLCJyZXF1aXJlcyI6W10sIm92ZXJyaWRlcyI6W10sImNvbmZsaWN0cyI6W119LHsiaWQiOiJhbHBoYS51aS5tb2Rlcm4iLCJ2ZXJzaW9uIjoiMS4wLjAiLCJzZXF1ZW5jZSI6MSwibWFuaWZlc3RQYXRoIjoicGFja2FnZXMvYWxwaGEudWkubW9kZXJuLzEuMC4wL3BhY2thZ2UuanNvbiIsIm1hbmlmZXN0RGlnZXN0Ijoic2hhMjU2OjY1N2I4ODc0OTM2ZmRmN2JkZGQ1MDBlOGI0YWYzYzc2YTQzNmQ1MzBiN2M4NGNlZjljMmNjZmRiZTczMWUzNGMiLCJmaWxlQ291bnQiOjEsImluc3RhbGxTaXplIjoxMywiZG93bmxvYWRTaXplIjoxMywicmVxdWlyZXMiOltdLCJvdmVycmlkZXMiOltdLCJjb25mbGljdHMiOltdfV0sImNvdmVyYWdlRGlnZXN0Ijoic2hhMjU2OjQ1ZjEyYTczNDhmZjAxM2I1YTc2ZmRhYzVlZDdjYmNjOTU3MzFmZjY1NWU4ZTY0Mjk5NmNiNDY2ZTg1MWVmNzEifQ","signatures":[{"keyId":"fixture-root","algorithm":"ed25519","signature":"kk3BEJOd1_K46b3vOfR98Jte34xv7Au9BR-JmTzJc-FAzbhcUBa2-xeymRqriMi5GsvL-MtPUxtTsK0Rj05sDA"}]}