{"envelope":1,"type":"release-lock","payload":"eyJzY2hlbWFWZXJzaW9uIjoxLCJwcm9kdWN0SWQiOiJiZXRhLnByb2R1Y3QiLCJyZWxlYXNlSWQiOiJiZXRhLTEiLCJzZXF1ZW5jZSI6MSwic3RhdGUiOiJwdWJsaXNoZWQiLCJjcmVhdGVkQXQiOiIyMDI2LTAxLTAxVDAwOjAwOjAwWiIsImF4ZXMiOltdLCJyZXF1aXJlbWVudHMiOlt7InBhY2thZ2UiOiJiZXRhLmNvcmUiLCJ3aGVuIjp7ImNvbnN0cmFpbnRzIjp7fSwiaXNBbHdheXMiOnRydWV9LCJvdmVycmlkZXMiOltdLCJvcHRpb25hbCI6ZmFsc2V9LHsicGFja2FnZSI6ImJldGEudG9vbHMiLCJ3aGVuIjp7ImNvbnN0cmFpbnRzIjp7fSwiaXNBbHdheXMiOnRydWV9LCJvdmVycmlkZXMiOltdLCJvcHRpb25hbCI6ZmFsc2V9XSwicGFja2FnZXMiOlt7ImlkIjoiYmV0YS5jb3JlIiwidmVyc2lvbiI6IjEuMC4wIiwic2VxdWVuY2UiOjEsIm1hbmlmZXN0UGF0aCI6InBhY2thZ2VzL2JldGEuY29yZS8xLjAuMC9wYWNrYWdlLmpzb24iLCJtYW5pZmVzdERpZ2VzdCI6InNoYTI1NjpmYzk3N2YzM2FkMzQzOTk5ZDQxNjhhODlkNjM4Njc1NDYyMzc4MDQ0Y2U4ODY4ZWI5NGRmOTIzNTQ5NDUxZDM0IiwiZmlsZUNvdW50IjoxLCJpbnN0YWxsU2l6ZSI6MTAsImRvd25sb2FkU2l6ZSI6MTAsInJlcXVpcmVzIjpbXSwib3ZlcnJpZGVzIjpbXSwiY29uZmxpY3RzIjpbXX0seyJpZCI6ImJldGEudG9vbHMiLCJ2ZXJzaW9uIjoiMS4wLjAiLCJzZXF1ZW5jZSI6MSwibWFuaWZlc3RQYXRoIjoicGFja2FnZXMvYmV0YS50b29scy8xLjAuMC9wYWNrYWdlLmpzb24iLCJtYW5pZmVzdERpZ2VzdCI6InNoYTI1Njo2YmYzMmM1MmIwY2RkYWY2ZWRmMWMwYTYxZDg3ODljMjY1NzZiN2IyYzZhMjZiYjA5ODdhZmNkYjgzNDM5OWFmIiwiZmlsZUNvdW50IjoxLCJpbnN0YWxsU2l6ZSI6MTEsImRvd25sb2FkU2l6ZSI6MTEsInJlcXVpcmVzIjpbXSwib3ZlcnJpZGVzIjpbXSwiY29uZmxpY3RzIjpbXX1dLCJjb3ZlcmFnZURpZ2VzdCI6InNoYTI1NjphMTQ5M2RiNmJiYThkMDIxYzJjNmUwYTlmOTM4NjZmZTRlM2M1OGViZGJjMDcyOGIzNGQ0ZjkyZTBlYWIxZDk3In0","signatures":[{"keyId":"fixture-root","algorithm":"ed25519","signature":"av2dCnhCWr1b8X0uwS5JyzFHEf-rNxyg88sMy7CLaAnPoY3_qjfzhTllghBemRzUlRTjK-aQ4dsCbGY6s8tlBQ"}]}