{"envelope":1,"type":"channel-pointer","payload":"eyJzY2hlbWFWZXJzaW9uIjoxLCJwcm9kdWN0SWQiOiJhbHBoYS5wcm9kdWN0IiwiY2hhbm5lbCI6ImxpdmUiLCJjaGFubmVsU2VxdWVuY2UiOjIsInN1cGVyc2VkZXNDaGFubmVsU2VxdWVuY2UiOjAsInJlbGVhc2VJZCI6ImFscGhhLTIiLCJyZWxlYXNlU2VxdWVuY2UiOjIsInJlbGVhc2VEaWdlc3QiOiJzaGEyNTY6NjFjMTRiNjk3ZDgzMWY0NGE1YzVkYTJkNWQ3NzczMTViYjU5ZDEwMjk2ZTFjZTI0MDAzZmNkMTI2ZTg3OWNhMyIsInVwZGF0ZWRBdCI6IjIwMjYtMDEtMDFUMDA6MDA6MDBaIn0","signatures":[{"keyId":"fixture-root","algorithm":"ed25519","signature":"P3PjZnx0L34ChLDT6jOX4ubeXz5Ug1HwZkwN8Wj8DqgA6oaEY363qhC4BW4YdkP8MPcjqtgYiXal9HQ_0oSeDw"}]}