{"envelope":1,"type":"key-manifest","payload":"eyJzY2hlbWFWZXJzaW9uIjoxLCJrZXlTZXF1ZW5jZSI6MSwia2V5cyI6W3sia2V5SWQiOiJmaXh0dXJlLXJvb3QiLCJhbGdvcml0aG0iOiJlZDI1NTE5IiwicHVibGljS2V5IjoiZWJWV0xvX21WUGxBZUxFUzZLbUxwNUFmaFRybWxiN1g0T09SQzYwRWxtUSIsIm5vdEJlZm9yZSI6IjIwMjYtMDEtMDFUMDA6MDA6MDBaIiwibm90QWZ0ZXIiOiIyMDI3LTAxLTAxVDAwOjAwOjAwWiJ9XSwicmV2b2tlZEtleUlkcyI6W119","signatures":[{"keyId":"fixture-root","algorithm":"ed25519","signature":"5seAZ33uUl-eTBbIMHdfSE50p-QJo4x7VI3j6hLsf84yZOFyjdLhgIlqpOVB3nZBEAKxUNnOnhZW3rOmzxflCw"}]}