{"envelope":1,"type":"release-lock","payload":"eyJzY2hlbWFWZXJzaW9uIjoxLCJwcm9kdWN0SWQiOiJhbHBoYS5wcm9kdWN0IiwicmVsZWFzZUlkIjoiYWxwaGEtMSIsInNlcXVlbmNlIjoxLCJzdGF0ZSI6InB1Ymxpc2hlZCIsImNyZWF0ZWRBdCI6IjIwMjYtMDEtMDFUMDA6MDA6MDBaIiwiYXhlcyI6W10sInJlcXVpcmVtZW50cyI6W3sicGFja2FnZSI6ImFscGhhLmNvcmUiLCJ3aGVuIjp7ImNvbnN0cmFpbnRzIjp7fSwiaXNBbHdheXMiOnRydWV9LCJvdmVycmlkZXMiOltdLCJvcHRpb25hbCI6ZmFsc2V9LHsicGFja2FnZSI6ImFscGhhLnVpLmNsYXNzaWMiLCJ3aGVuIjp7ImNvbnN0cmFpbnRzIjp7fSwiaXNBbHdheXMiOnRydWV9LCJvdmVycmlkZXMiOltdLCJvcHRpb25hbCI6ZmFsc2V9XSwicGFja2FnZXMiOlt7ImlkIjoiYWxwaGEuY29yZSIsInZlcnNpb24iOiIxLjAuMCIsInNlcXVlbmNlIjoxLCJtYW5pZmVzdFBhdGgiOiJwYWNrYWdlcy9hbHBoYS5jb3JlLzEuMC4wL3BhY2thZ2UuanNvbiIsIm1hbmlmZXN0RGlnZXN0Ijoic2hhMjU2OmZjMjY1NDU4YTkyYzYxYTNmNWU5OGI4N2FjYTIyZTk3ZGQzNTFiY2NjN2Q0NGNmMzQ4NmE1YWJiODk5ZDdhMTAiLCJmaWxlQ291bnQiOjEsImluc3RhbGxTaXplIjoxMSwiZG93bmxvYWRTaXplIjoxMSwicmVxdWlyZXMiOltdLCJvdmVycmlkZXMiOltdLCJjb25mbGljdHMiOltdfSx7ImlkIjoiYWxwaGEudWkuY2xhc3NpYyIsInZlcnNpb24iOiIxLjAuMCIsInNlcXVlbmNlIjoxLCJtYW5pZmVzdFBhdGgiOiJwYWNrYWdlcy9hbHBoYS51aS5jbGFzc2ljLzEuMC4wL3BhY2thZ2UuanNvbiIsIm1hbmlmZXN0RGlnZXN0Ijoic2hhMjU2OmI0MjQ1NDllOTNjMDQ2NmRkY2IyZDM2YmYwNjZhNzViZjk5ZDdhYzFmOGIyYjBmZTVhYzJkNzcwMjYzNWU0ZjciLCJmaWxlQ291bnQiOjEsImluc3RhbGxTaXplIjoxNCwiZG93bmxvYWRTaXplIjoxNCwicmVxdWlyZXMiOltdLCJvdmVycmlkZXMiOltdLCJjb25mbGljdHMiOltdfV0sImNvdmVyYWdlRGlnZXN0Ijoic2hhMjU2OjAzNTY4Y2Q2YzNmNTFmN2RjMTkwMTYzM2Q3Y2Q5ZjVlMGIxOGY0ZTg1YTRjMjVjMDMwYzY4OWYyOGMzZTBlMmIifQ","signatures":[{"keyId":"fixture-root","algorithm":"ed25519","signature":"WBz0RnljCJfv_nNKMTTIaDicwO_RVCJ_oZHJmTOsnlIwYKo4PgYHm5I0ApX4oo-nImtM4_lSAVY8mS-G3YTXBg"}]}